url,title,date_extracted,content,category,title_en,content_en
https://www.1tv.ru/news/2026-02-13/533714,"Главы государств и правительств съехались в Мюнхен, где открылась конференция по безопасности",2026-02-13,В Мюнхене открылась конференция по безопасности. Американскую делегацию возглавляет госсекретарь Марко Рубио.,,Heads of state and government meet in Munich for security conference,A security conference opened in Munich. The US delegation is headed by Secretary of State Marco Rubio.
https://www.1tv.ru/news/2026-02-13/533730,"ВСУ атаковали Белгородскую область, есть погибшие и раненые",2026-02-13,"Один из пострадавших находится в тяжелом состоянии, уточнил Гладков.",,"AFU attacked the Belgorod region, there are dead and wounded","One of the victims is in serious condition, said Gladkov."
https://www.1tv.ru/news/2026-02-13/533696,"Сотрудники ФСБ в Крыму ликвидировали ячейку террористической организации, запрещенной в России",2026-02-13,Задержанные в Бахчисарайском районе радикалы вербовали сторонников из числа местных мусульман. Распространяли идеологию так называемого всемирного халифата.,,FSB officers in Crimea liquidated a cell of a terrorist organization banned in Russia,The radicals detained in the Bakhchisarai district recruited supporters from among local Muslims. They spread the ideology of the so-called world caliphate.
https://www.1tv.ru/news/2026-02-14/533803,Выпуск программы «Время» от 14.02.2026,2026-02-14,"Смотрите в этом выпуске: удары по артиллерийской базе, площадкам запуска беспилотников и другим объектам ВСУ — Минобороны о ходе спецоперации; заканчивается ли эпоха доминирования Запада, как продвигается урегулирование украинского конфликта и что о происходящем думает Китай — заявления на Мюнхенской конференции по безопасности; 1065-й Гвардейский артиллерийский полк ВДВ награжден орденом Кутузова",,"Release of the program ""Time"" from 14.02. 2026","See in this issue: strikes on the artillery base, drone launch sites and other objects of the Armed Forces of Ukraine - the Ministry of Defense about the progress of the special operation; whether the era of Western domination ends, how the settlement of the Ukrainian conflict is progressing and what China thinks about what is happening - statements at the Munich Security Conference; the 1065th Guards Artillery Regiment of the Airborne was awarded the Order of Kutuzov"
https://www.1tv.ru/news/2026-02-14/533799,В Эрмитаже открылась выставка с экспонатами из коллекции Марии Захаровой,2026-02-14,"Она рассказала, что ее курсовая работа во время учебы в МГИМО была посвящена отражению культуры чая в китайском романе «Сон в красном тереме».",,In the Hermitage opened an exhibition with exhibits from the collection of Maria Zakharova,She said that her coursework during her studies at MGIMO was devoted to the reflection of tea culture in the Chinese novel “Dream in the Red Chamber”.
https://www.1tv.ru/news/2026-02-14/533802,В Новосибирске проходит Зимний фестиваль по строительству снежных хижин,2026-02-14,"Город в городе. Иглу с архитектурной точки зрения называют удивительными сооружениями. Хижины эскимосов из снега, и при правильной обработке они могут согревать даже в лютые морозы.",,In Novosibirsk hosted the Winter festival for the construction of snow huts,"City in town. From an architectural point of view, igloos are called amazing structures. Eskimo huts are made of snow, and with proper processing they can warm even in severe frosts."
https://www.1tv.ru/news/2026-02-14/533801,На смену оттепели в столичном регионе идет резкое похолодание,2026-02-14,"Уже через несколько часов плюсовая температура сменится минусовой, а к вечеру воскресенья, 15 февраля, по прогнозу -13. Таким образом, суточный перепад составит 15 градусов.",,To replace the thaw in the capital region is a sharp cold snap,"In a few hours, the plus temperature will change to minus, and by the evening of Sunday, February 15, according to the forecast -13. Thus, the daily difference will be 15 degrees."
https://www.1tv.ru/news/2026-02-14/533798,Профессионалы и любители в разных регионах страны приняли участие в гонке «Лыжня России»,2026-02-14,"О празднике спорта и здорового, активного образа жизни. Главное — участие. И хорошее настроение на выходные и будущую неделю.",,Professionals and amateurs in different regions of the country took part in the race “Ski of Russia”,"About the celebration of sports and a healthy, active lifestyle. The key is participation. And a good mood for the weekend and next week."
https://www.1tv.ru/news/2026-02-14/533797,В Москве в Аптекарском огороде сегодня открылась выставка «Репетиция весны»,2026-02-14,"Более 10 тысяч тюльпанов, нарциссов, крокусов, гиацинтов и других цветов распустились на два месяца раньше срока, чтобы порадовать жителей и гостей столицы.",,"In Moscow in the Aptekarsky garden today opened the exhibition ""Rehearsal of spring""","More than 10 thousand tulips, daffodils, crocuses, hyacinths and other flowers bloomed two months ahead of schedule to please residents and guests of the capital."
https://www.1tv.ru/news/2026-02-14/533796,В Эрмитаже широкой публике впервые показывают уникальные экспонаты из Поднебесной,2026-02-14,"Китайская керамика, тончайшая работа, как будто кукольные сервизы с невероятно сложно выполненными узорами, знаками и посланиями от самых известных китайских мастеров.",,In the Hermitage to the public for the first time show unique exhibits from China,"Chinese ceramics, the finest work, as if puppet sets with incredibly intricately executed patterns, signs and messages from the most famous Chinese masters."
https://www.1tv.ru/news/2026-02-14/533795,Орденом Кутузова награжден 1065-й Гвардейский артиллерийский полк из Костромы,2026-02-14,"Полк ведет свою славную историю с 1943 года. Бойцы освобождали от фашистских захватчиков Австрию, Венгрию. Сражались на Северном Кавказе и в Южной Осетии.",,Kutuzov Order awarded 1065th Guards Artillery Regiment from Kostroma,The regiment has had its glorious history since 1943. The fighters liberated Austria and Hungary from the fascist invaders. They fought in the North Caucasus and South Ossetia.
https://www.1tv.ru/news/2026-02-14/533794,83 года назад немецко-фашистских захватчиков выбили из Ростова-на-Дону и Ворошиловграда,2026-02-14,"Важные исторические даты, о которых хорошо бы помнить тем, кто в наши дни грезит поражением России. В Ростове-на-Дону памятная церемония — цветы к мемориалу красноармейцам, погибшим в боях.",,83 years ago the Nazi invaders were driven from Rostov-on-Don and Voroshilovgrad,"Important historical dates, which would be good to remember those who today dream of the defeat of Russia. In Rostov-on-Don, a commemorative ceremony - flowers to the memorial to the Red Army soldiers who died in battle."
https://www.1tv.ru/news/2026-02-14/533792,В Сергиевом Посаде из-за взрыва газового баллона загорелись три дома,2026-02-14,Об этом сообщили в «Мособлпожспасе».,,In Sergiev Posad due to the explosion of a gas cylinder caught fire three houses,This was reported in Mosoblpozhspas.
https://www.1tv.ru/news/2026-02-14/533793,На конференции в Мюнхене Марко Рубио заявил о завершении эпохи доминирования Запада,2026-02-14,"Европейские политики сегодня ждали, что же скажет американский госсекретарь. Он подчеркнул: ООН не смогла повлиять на завершение конфликта на Украине, и диалог стал возможен благодаря США и прогресс в урегулировании есть.",,"At a conference in Munich, Marco Rubio announced the end of the era of Western domination.","European politicians were waiting for the US Secretary of State to say. The UN has not been able to influence the end of the conflict in Ukraine, and dialogue has been made possible thanks to the United States and there is progress in the settlement."
https://www.1tv.ru/news/2026-02-14/533791,"Сегодня стало известно, что ключевые переговорщики от США останутся прежними",2026-02-14,"В Швейцарию прилетят специальный представитель американского президента Стивен Уиткофф и зять хозяина Белого дома, бизнесмен Джаред Кушнер. Об этом сообщил госсекретарь Соединенных Штатов Марко Рубио.",,Today it became known that the key negotiators from the United States will remain the same.,"In Switzerland will arrive special representative of the American President Stephen Whitkoff and son-in-law of the owner of the White house, businessman Jared Kushner. This was announced by US Secretary of State Marco Rubio."
https://www.1tv.ru/news/2026-02-14/533790,"В Минобороны подтвердили удары по объектам энергетики и транспорта, связанным с ВСУ",2026-02-14,"Также в списке целей центральная база ракетно-артиллерийского вооружения, места хранения и запуска дальних беспилотников. Что касается фронта, наши бойцы продвигаются на ключевых участках.",,The Ministry of Defense confirmed strikes on energy and transport facilities associated with the AFU,"Also on the list of targets is the central base of missile and artillery weapons, storage and launch of long-range drones. As for the front, our fighters are advancing in key areas."
https://www.1tv.ru/news/2026-02-14/533788,Комика Нурлана Сабурова внесли в базу украинского сайта «Миротворец»*,2026-02-14,Его обвиняют в покушении на суверенитет Украины и финансировании ВС России.,,Comedian Nurlan Saburov made in the database of the Ukrainian site “Peacemaker” *,He is accused of encroaching on the sovereignty of Ukraine and financing the Russian Armed Forces.
https://www.1tv.ru/news/2026-02-14/533787,Подросток умер из-за схода снега с кровли хоккейного корта в ХМАО,2026-02-14,Еще один несовершеннолетний госпитализирован.,,The teenager died because of the snow from the roof of the hockey court in KhMAO,Another minor was hospitalized.
https://www.1tv.ru/news/2026-02-15/533861,Выпуск программы «Воскресное время» от 15.02.2026,2026-02-15,Смотрите в этом выпуске: российская армия освободила четыре населенных пункта в Запорожской области; на Украине задержан бывший глава Минюста Герман Галущенко; пресса подводит итоги трехдневной конференции по безопасности в Мюнхене.,,"Release of the program ""Sunday time"" from 15.02. 2026",See in this issue: the Russian army liberated four settlements in the Zaporozhye region; in Ukraine detained the former head of the Ministry of justice German Galushchenko; the press sums up the results of a three-day security conference in Munich.
https://www.1tv.ru/news/2026-02-15/533876,Продолжается нефтяная блокада Кубы со стороны США,2026-02-15,"На этой неделе с Острова Свободы стартовали вывозные рейсы для наших туристов. Это направление россияне любят и давно. По словам наших дипломатов, отдыхающих около четырех тысяч.",,US oil blockade of Cuba continues,"This week, outbound flights for our tourists started from Liberty Island. Russians have loved this direction for a long time. According to our diplomats, vacationing about four thousand."
https://www.1tv.ru/news/2026-02-15/533875,В России отметили День дипломатического работника,2026-02-15,Традиции профессионального и самоотверженного служения Отечеству бережно хранят. Приоритеты внешней политики России обозначил Сергей Лавров.,,In Russia celebrated the Day of diplomatic worker,The traditions of professional and selfless service to the Fatherland are carefully preserved. Russia’s foreign policy priorities were outlined by Sergey Lavrov.
https://www.1tv.ru/news/2026-02-15/533874,В правительстве обсудили поддержку многодетных семей,2026-02-15,"Они продолжат получать пособия, даже если доходы незначительно выйдут за рамки, указанные в критериях. Это сделано по поручению Владимира Путина после обращения к президенту во время Прямой линии.",,The government discussed the support of large families,They will continue to receive benefits even if the income falls slightly beyond the criteria. This was done on behalf of Vladimir Putin after addressing the president during the Direct Line.
https://www.1tv.ru/news/2026-02-15/533873,Владимир Путин в Кремле принял мэра Москвы Сергея Собянина,2026-02-15,"Итоги минувшего года впечатляют, а все потому что колоссальная работа не прекращается по самым разным направлениям. Современные промышленные кластеры, развитие беспилотного транспорта.",,Vladimir Putin in the Kremlin received the mayor of Moscow Sergey Sobyanin,"The results of the past year are impressive, and all because the colossal work does not stop in a variety of areas. Modern industrial clusters, the development of unmanned transport."
https://www.1tv.ru/news/2026-02-15/533872,Итоги пятилетней работы фонда «Круг добра» подвели в Кремле,2026-02-15,"На этой неделе Владимир Путин принял председателя правления фонда протоиерея Александра Ткаченко. Более 30 тысяч подопечных, 110 тяжелых орфанных заболеваний, 133 инновационных препарата — колоссальный труд не прекращается ни на минуту.",,The results of the five-year work of the Circle of Good Foundation were summed up in the Kremlin,"This week, Vladimir Putin received the chairman of the board of the foundation, Archpriest Alexander Tkachenko. More than 30 thousand wards, 110 serious orphan diseases, 133 innovative drugs – a colossal work does not stop for a minute."
https://www.1tv.ru/news/2026-02-15/533871,В топе мировых новостей остаются по-прежнему файлы Эпштейна,2026-02-15,"Рассекреченные материалы шокируют. Западная элита оказалась еще более морально разложившейся, чем предполагали. И ведь это только верхушка айсберга.",,In the top of the world news are still files Epstein,The declassified materials are shocking. The Western elite has proved to be even more morally corrupt than expected. And that's just the tip of the iceberg.
https://www.1tv.ru/news/2026-02-15/533870,38 лет прошло со дня знаменитого «Красного навала»,2026-02-15,"Дипломаты отстаивают интересы нашей страны на международной арене, но когда переговоры оказываются бессильны или кто-то пытается провоцировать, вступают в дело два известных союзника России — ее армия и флот.",,"38 years have passed since the famous ""Red Bulge""","Diplomats defend the interests of our country in the international arena, but when negotiations turn out to be powerless or someone tries to provoke, two well-known allies of Russia come into action - its army and navy."
https://www.1tv.ru/news/2026-02-15/533869,На следующей неделе в Женеве планируется новый раунд переговоров по урегулированию украинского конфликта,2026-02-15,"Встреча намечена на 17-18 февраля. Формат: Россия-США-Украина. И если в ходе предыдущих переговоров поднимались в основном военные вопросы, то в Женеве планируется обсудить вопросы политические.",,"Next week, a new round of negotiations on the settlement of the Ukrainian conflict is planned in Geneva","The meeting is scheduled for February 17-18. Format: Russia-US-Ukraine. While previous talks have focused on military issues, Geneva is planning to discuss political issues."
https://www.1tv.ru/news/2026-02-15/533868,На полях Мюнхенской конференции по безопасности провалились переговоры по дальнейшему финансированию Украины,2026-02-15,Противоречий между Старым и Новым светом все больше. А ведь ключевые тезисы о мировой безопасности прозвучали в Мюнхене еще 19 лет назад.,,On the sidelines of the Munich Security Conference failed negotiations on further financing of Ukraine,The conflict between the Old and New Worlds is growing. The key points about global security were made in Munich 19 years ago.
https://www.1tv.ru/news/2026-02-15/533867,Депутаты Рады одобрили закон о принудительной эвакуации детей из зон боевых действий,2026-02-15,"Откровенная ложь киевского режима — привычное дело. Так нынешняя украинская верхушка оправдывает свои действия. А чтобы ложь выглядела правдоподобнее, подводит под нее законодательную базу.",,Rada deputies approved the law on forced evacuation of children from combat zones,"The outright lies of the Kiev regime are commonplace. Thus, the current Ukrainian elite justifies its actions. And to make the lie look more plausible, it brings the legislative base under it."
https://www.1tv.ru/news/2026-02-15/533866,Зеленский разрешил набирать на контрактную службу мужчин старше 60 лет,2026-02-15,"В интернете каждый день новые видео, одно страшнее другого. И точка кипения все ближе: украинцы и украинки при виде людоловов хватаются за вилы и другие опасные предметы.",,Zelensky allowed to recruit for contract service men over 60 years,"On the Internet every day new videos, one more scary than the other. And the boiling point is getting closer: Ukrainians and Ukrainian women at the sight of ludols grab forks and other dangerous objects."
https://www.1tv.ru/news/2026-02-15/533880,Богомаз: ВСУ атакуют Брянскую область более 12 часов,2026-02-15,В результате удара по объектам энергетической инфраструктуры в пяти муниципальных образованиях и частично в городе отсутствует тепло и электричество.,,Bogomaz: APU attacked the Bryansk region for more than 12 hours,As a result of the impact on energy infrastructure facilities in five municipalities and partially in the city there is no heat and electricity.
https://www.1tv.ru/news/2026-02-15/533865,Экс-министр юстиции Украины Герман Галущенко пытался сбежать из страны,2026-02-15,"Галущенко был отправлен в отставку с поста главы Минюста в ноябре, когда дело о масштабных хищениях в «Энергоатоме» только набирало обороты.",,Former Minister of Justice of Ukraine German Galushchenko tried to flee the country,"Galushchenko was dismissed as the head of the Ministry of Justice in November, when the case of large-scale embezzlement in Energoatom was only gaining momentum."
https://www.1tv.ru/news/2026-02-15/533863,Киевский режим отправляет в Димитров все новые и новые диверсионные группы,2026-02-15,"Город-спутник Красноармейска, освобожден российской армией за несколько дней до нового года. Сам Красноармейск и того раньше. Но киевский режим существует в своей реальности.",,Kiev regime sends more and more sabotage groups to Dimitrov,"The satellite city of Krasnoarmeisk, liberated by the Russian army a few days before the new year. Krasnoarmeysk and before. But the Kiev regime exists in reality."
