url,title,date_extracted,content,category,title_en,content_en
https://www.1tv.ru/news/2026-02-03/532774,Конституционный суд разрешил гражданам временную регистрацию в апартаментах,2026-02-03,"Соучастника нападения на техникум в Анапе задержали в Краснодарском крае
В СК России сообщили, что он подозревается в подстрекательстве к совершению убийства и покушению на убийство.
Сегодня, 13:26",,Constitutional Court Allows Citizens Temporary Registration in Apartments,"Accomplice in the attack on the technical school in Anapa detained in the Krasnodar region
The Investigative Committee of Russia reported that he is suspected of incitement to commit murder and attempted murder.
Today, 13:26."
https://www.1tv.ru/news/2026-02-07/533155,ВСУ атаковали Брянскую область дальнобойными ракетами «Нептун» и РСЗО Himars,2026-02-07,"Минздрав: закрыть больничный теперь можно через мессенджер Max
Лечащий врач может дистанционно проверить состояние здоровья пациента.
Сегодня, 13:29",,"APU attacked the Bryansk region long-range missiles ""Neptune"" and MLRS Himars","The Ministry of Health: you can now close the hospital through the Max messenger
The attending physician can remotely check the patient's health.
Today, 13:29."
https://www.1tv.ru/news/2026-02-12/533567,С космодрома «Байконур» стартовала тяжелая ракета-носитель «Протон-М»,2026-02-12,"Выпуск программы «Время» от 11.02.2026
Смотрите в этом выпуске: нанесены новые удары по украинским военным тылам и продолжается продвижение на передовой; репортаж о том, как готовят бойцов для Войск беспилотных систем в учебном центре Росгвардии в Подмосковье; с вилами и палками на людоловов Зеленского — на Украине все жестче отпор насильственной мобилизации;
11 февраля, 22:05",,"From the cosmodrome ""Baikonur"" launched a heavy carrier rocket ""Proton-M""","Release of the program ""Time"" from 11.02. 2026
See in this issue: new blows were inflicted on the Ukrainian military rear and progress continues on the front lines; a report on how fighters are being trained for the UAV Troops in the training center of Regardie in the Moscow region; with pitchforks and sticks on Zelensky’s ludols – in Ukraine, violent mobilization is increasingly rebuffed;
February 11, 22:05"
https://www.1tv.ru/news/2026-01-24/531869,Bloomberg: европейцы способны лишь советоваться и колебаться,2026-01-24,"Выпуск программы «Время» от 10.02.2026
Смотрите в этом выпуске: В ФСБ сообщили о задержании еще одного соучастника покушения на генерал-лейтенанта Владимира Алексеева; в Запорожской области ВСУ нанесли удар по людям во время похоронной процессии в селе Скельки; об атаках украинских террористов на объекты промышленности, энергетики и транспорта говорили на заседании НАК.
10 февраля, 22:00",,Bloomberg: Europeans can only consult and hesitate,"Release of the program ""Time"" from 10.02. 2026
Watch this episode: The FSB reported on the detention of another accomplice in the assassination attempt on Lieutenant General Vladimir Alekseev; in the Zaporozhye region, the AFU struck people during a funeral procession in the village of Skelki; attacks by Ukrainian terrorists on industrial, energy and transport facilities were discussed at a meeting of the NAC.
February 10, 22:00"
https://www.1tv.ru/news/2026-02-10/533432,Петр Гуменник лидирует после первой разминки на Олимпиаде,2026-02-10,"Российские силы ПВО за сутки сбили пять крылатых ракет ВСУ «Фламинго»
Также бойцы РФ уничтожили 211 украинских дронов.
Сегодня, 13:54",,Petr Gumennik leads after first warm-up at the Olympics,"Russian air defense forces shot down five Flamingo cruise missiles in a day
Russian fighters also destroyed 211 Ukrainian drones.
Today, 13:54."
https://www.1tv.ru/news/2026-01-27/532049,Импортозамещенный «Суперджет» и турбовинтовой Ил-114-300 прибыли на международную выставку Wings India,2026-01-27,"Российские силы ПВО за сутки сбили пять крылатых ракет ВСУ «Фламинго»
Также бойцы РФ уничтожили 211 украинских дронов.
Сегодня, 13:54",,"Import-substituted ""Superjet"" and turboprop IL-114-300 arrived at the international exhibition Wings India","Russian air defense forces shot down five Flamingo cruise missiles in a day
Russian fighters also destroyed 211 Ukrainian drones.
Today, 13:54."
https://www.1tv.ru/news/2026-02-12/533541,Зарплаты военных осенью повысят на 4%,2026-02-12,"Выпуск новостей в 15:00 от 12.02.2026
В Русском музее начался финальный этап монтажа шедевра Карла Брюллова
На свое место в Михайловском дворце вернулась картина «Последний день Помпеи». Учитывая гигантские размеры полотна — 6,5 на 4,5 метра, на время работ пришлось закрыть для посетителей сразу несколько залов до следующего вторника.
Сегодня, 15:13",,Military salaries will increase by 4% in autumn,"News release at 15:00 from 12.02. 2026
In the Russian Museum began the final stage of installation of the masterpiece of Karl Bryullov
The painting “The Last Day of Pompeii” returned to its place in the Mikhailovsky Palace. Given the giant size of the canvas — 6.5 by 4.5 meters, during the work had to close for visitors several halls until next Tuesday.
Today, 15:13."
https://www.1tv.ru/news/2026-01-25/531927,Бастрыкин вручил ведомственные награды бойцам ВС РФ в Санкт-Петербургском госпитале,2026-01-25,"Выпуск новостей в 15:00 от 12.02.2026
Смотрите в этом выпуске: Владимир Путин в Кремле встретился с руководителем Росимущества Вадимом Яковенко; в нашем Минобороны сегодня подтвердили групповой удар по энергетическим объектам на Украине; ажиотаж среди желающих служить в войсках беспилотных систем; новый мощный снегопад обрушился на московский регион.
Сегодня, 15:15",,Bastrykin presented departmental awards to soldiers of the Armed Forces of the Russian Federation in St. Petersburg hospital,"News release at 15:00 from 12.02. 2026
See in this issue: Vladimir Putin in the Kremlin met with the head of the Federal Property Management Agency Vadim Yakovenko; in our Defense Ministry today confirmed a group strike on energy facilities in Ukraine; excitement among those who want to serve in the troops of unmanned systems; a new powerful snowfall hit the Moscow region.
Today, 15:15."
https://www.1tv.ru/news/2026-01-27/532047,27 января — Международный день памяти жертв Холокоста,2026-01-27,"В Новосибирске начались поиски пропавшей на берегу Оби девочки
В следственном управлении СК России по региону предполагают, что ребенок мог утонуть, катаясь на «ватрушке».
Сегодня, 15:35",,January 27 – International Holocaust Remembrance Day,"In Novosibirsk began the search for missing on the banks of the Ob girl
The Investigative Department of the Investigative Committee of Russia in the region suggest that the child could drown while riding a “vatrushka”.
Today, 15:35."
https://www.1tv.ru/news/2026-01-25/531898,В России отмечают День штурмана Военно-морского флота,2026-01-25,"В Новосибирске начались поиски пропавшей на берегу Оби девочки
В следственном управлении СК России по региону предполагают, что ребенок мог утонуть, катаясь на «ватрушке».
Сегодня, 15:35",,In Russia celebrate the Day of the Navigator of the Navy,"In Novosibirsk began the search for missing on the banks of the Ob girl
The Investigative Department of the Investigative Committee of Russia in the region suggest that the child could drown while riding a “vatrushka”.
Today, 15:35."
https://www.1tv.ru/news/2026-01-25/531882,Силы ПВО перехватили за ночь 52 дрона ВСУ над Россией,2026-01-25,"В Новосибирске начались поиски пропавшей на берегу Оби девочки
В следственном управлении СК России по региону предполагают, что ребенок мог утонуть, катаясь на «ватрушке».
Сегодня, 15:35",,Air Defense Forces intercepted 52 AFU drones over Russia overnight,"In Novosibirsk began the search for missing on the banks of the Ob girl
The Investigative Department of the Investigative Committee of Russia in the region suggest that the child could drown while riding a “vatrushka”.
Today, 15:35."
https://www.1tv.ru/news/2026-01-25/531903,Синоптик рассказала о потеплении в Москве после морозов,2026-01-25,"Два военных корабля США столкнулись у берегов Южной Америки
Пострадали два человека, сообщила газета The Wall Street Journal.
Сегодня, 15:50",,Forecaster told about warming in Moscow after frost,"Two US warships collided off the coast of South America
Two people were injured, the Wall Street Journal reported.
Today, 15:50."
https://www.1tv.ru/news/2026-01-26/531987,В Минобороны заявили о новых ударах по военным тылам на Украине,2026-01-26,"Два военных корабля США столкнулись у берегов Южной Америки
Пострадали два человека, сообщила газета The Wall Street Journal.
12 февраля, 15:50",,The Ministry of Defense announced new strikes on the military rear in Ukraine,"Two US warships collided off the coast of South America
Two people were injured, the Wall Street Journal reported.
February 12, 15:50"
https://www.1tv.ru/news/2026-01-26/531966,Появились кадры с места крушения парома у побережья Филиппин,2026-01-26,"Два военных корабля США столкнулись у берегов Южной Америки
Пострадали два человека, сообщила газета The Wall Street Journal.
12 февраля, 15:50",,Footage emerges from ferry crash site off Philippines coast,"Two US warships collided off the coast of South America
Two people were injured, the Wall Street Journal reported.
February 12, 15:50"
https://www.1tv.ru/news/2026-01-27/532127,Дептранс Москвы попросил такси не повышать цены на поездки из-за снегопада,2026-01-27,"Появились кадры с места трагедии на берегу Оби, где под лед провалилась девочка
В СК РФ по Новосибирской области сообщили, что ребенок находился на реке без присмотра взрослых.
12 февраля, 16:43",,Deptrans of Moscow asked the taxi not to raise prices for trips due to snow,"Footage from the scene of the tragedy on the banks of the Ob, where the girl fell under the ice
In the IC of the Russian Federation in the Novosibirsk region reported that the child was on the river without adult supervision.
February 12, 16:43"
https://www.1tv.ru/news/2026-01-28/532153,Выпуск новостей в 12:00 от 28.01.2026,2026-01-28,"Появились кадры с места трагедии на берегу Оби, где под лед провалилась девочка
В СК РФ по Новосибирской области сообщили, что ребенок находился на реке без присмотра взрослых.
12 февраля, 16:43",,News release at 12:00 from 28.01. 2026,"Footage from the scene of the tragedy on the banks of the Ob, where the girl fell under the ice
In the IC of the Russian Federation in the Novosibirsk region reported that the child was on the river without adult supervision.
February 12, 16:43"
https://www.1tv.ru/news/2026-01-24/531855,"Новый раунд переговоров между делегациями России, США и Украины может состояться уже на следующей неделе",2026-01-24,"Появились кадры с места трагедии на берегу Оби, где под лед провалилась девочка
В СК РФ по Новосибирской области сообщили, что ребенок находился на реке без присмотра взрослых.
12 февраля, 16:43",,"A new round of talks between the delegations of Russia, the United States and Ukraine may take place next week.","Footage from the scene of the tragedy on the banks of the Ob, where the girl fell under the ice
In the IC of the Russian Federation in the Novosibirsk region reported that the child was on the river without adult supervision.
February 12, 16:43"
https://www.1tv.ru/news/2026-02-07/533145,"Роберт Фицо считает, что Украине следует сконцентрироваться на переговорах с Россией",2026-02-07,"Мать жениха в шоу «Давай поженимся!» назвала причину, по которой разрушила последние отношения сына
Ирина была возмущена тем, что бывшая девушка Дмитрия не стирала его рубашки.
12 февраля, 17:20",,Robert Fico says Ukraine should focus on talks with Russia,"The mother of the groom in the show “Let’s get married!” called the reason why she ruined the last relationship of her son
Irina was outraged that Dmitry’s ex-girlfriend did not wash his shirts.
February 12, 17:20"
https://www.1tv.ru/news/2026-01-27/532066,"В Канаде скончался один из старейших ветеранов Великой Отечественной, участник обороны Ленинграда Виктор Хоменко",2026-01-27,"Мать жениха в шоу «Давай поженимся!» назвала причину, по которой разрушила последние отношения сына
Ирина была возмущена тем, что бывшая девушка Дмитрия не стирала его рубашки.
12 февраля, 17:20",,"In Canada, died one of the oldest veterans of the Great Patriotic War, a member of the defense of Leningrad Viktor Khomenko","The mother of the groom in the show “Let’s get married!” called the reason why she ruined the last relationship of her son
Irina was outraged that Dmitry’s ex-girlfriend did not wash his shirts.
February 12, 17:20"
https://www.1tv.ru/news/issue/2026-01-26/21:00,Выпуск программы «Время» в 21:00 от 26.01.2026,2026-01-26,"Москвича оштрафовали за изображения с нацистской символикой
Он обязан выплатить 360 тыс. рублей.
12 февраля, 17:39",,"Release of the program ""Time"" at 21:00 from 26.01. 2026","Muscovite fined for images with Nazi symbols
He is obliged to pay 360 thousand rubles.
February 12, 17:39"
https://www.1tv.ru/news/2026-02-12/533547,Москву накрыл новый снегопад,2026-02-12,"Москвича оштрафовали за изображения с нацистской символикой
Он обязан выплатить 360 тыс. рублей.
12 февраля, 17:39",,Moscow was covered by a new snowfall,"Muscovite fined for images with Nazi symbols
He is obliged to pay 360 thousand rubles.
February 12, 17:39"
https://www.1tv.ru/news/2026-01-28/532167,Расследование дела блогера Гасанова об отмывании денег завершено,2026-01-28,"Москвича оштрафовали за изображения с нацистской символикой
Он обязан выплатить 360 тыс. рублей.
12 февраля, 17:39",,The investigation of blogger Gasanov about money laundering is completed,"Muscovite fined for images with Nazi symbols
He is obliged to pay 360 thousand rubles.
February 12, 17:39"
https://www.1tv.ru/news/2026-01-26/531996,Владимир Путин в Санкт-Петербурге принимает короля Малайзии,2026-01-26,"Лидеры тепло приветствовали друг друга, обменялись рукопожатием. Запланировано их общение один на один, но перед этим для зарубежного гостя провели небольшую экскурсию по Эрмитажу.",,Vladimir Putin in St. Petersburg receives the king of Malaysia,"The leaders warmly greeted each other and exchanged handshakes. Their one-on-one communication is planned, but before that, a short tour of the Hermitage was held for a foreign guest."
https://www.1tv.ru/news/2026-01-26/531954,Адаптивный спортзал открыли в Белгородской области,2026-01-26,Это уже четвертая из подобных площадок. 10 тренажеров полностью российского производства. Они созданы с учетом пожеланий наших бойцов. Ассортимент в дальнейшем планируют расширить.,,Adaptive gym opened in the Belgorod region,This is the fourth such site. 10 simulators completely Russian production. They were created according to the wishes of our soldiers. The range is planned to be expanded in the future.
https://www.1tv.ru/news/2026-01-27/532115,Под контролем российской армии Купянск-Узловой в Харьковской области,2026-01-27,"Выпуск новостей в 18:00 от 12.02.2026
Смотрите в этом выпуске: групповой удар нашей армии по вражеским военным тылам; командный пункт одного из соединений группировки войск «Юг» посетил министр обороны Андрей Белоусов; масштабные учения на полигоне Каспийской флотилии в Дагестане; итоги работы Росимущества Владимир Путин обсудил с главой ведомства Вадимом Яковенко; Куба переживает нефтяную блокаду США.
12 февраля, 18:30",,Under the control of the Russian army Kupyansk-Uzlova in the Kharkiv region,"News release at 18:00 from 12.02. 2026
See in this issue: a group strike of our army on enemy military rears; the command post of one of the formations of the group of troops ""South"" was visited by Defense Minister Andrei Belousov; large-scale exercises at the site of the Caspian Flotilla in Dagestan; the results of the work of the Federal Property Management Agency Vladimir Putin discussed with the head of the department Vadim Yakovenko; Cuba is experiencing an oil blockade of the United States.
February 12, 18:30"
https://www.1tv.ru/news/2026-01-24/531863,В Самарской области огневые испытания проходит ракетный двигатель РД-107,2026-01-24,"Выпуск новостей в 18:00 от 12.02.2026
Смотрите в этом выпуске: групповой удар нашей армии по вражеским военным тылам; командный пункт одного из соединений группировки войск «Юг» посетил министр обороны Андрей Белоусов; масштабные учения на полигоне Каспийской флотилии в Дагестане; итоги работы Росимущества Владимир Путин обсудил с главой ведомства Вадимом Яковенко; Куба переживает нефтяную блокаду США.
12 февраля, 18:30",,In the Samara region firing tests passes rocket engine RD-107,"News release at 18:00 from 12.02. 2026
See in this issue: a group strike of our army on enemy military rears; the command post of one of the formations of the group of troops ""South"" was visited by Defense Minister Andrei Belousov; large-scale exercises at the site of the Caspian Flotilla in Dagestan; the results of the work of the Federal Property Management Agency Vladimir Putin discussed with the head of the department Vadim Yakovenko; Cuba is experiencing an oil blockade of the United States.
February 12, 18:30"
https://www.1tv.ru/news/2026-02-07/533141,Выпуск программы «Время» от 07.02.2026,2026-02-07,"Выпуск новостей в 18:00 от 12.02.2026
Смотрите в этом выпуске: групповой удар нашей армии по вражеским военным тылам; командный пункт одного из соединений группировки войск «Юг» посетил министр обороны Андрей Белоусов; масштабные учения на полигоне Каспийской флотилии в Дагестане; итоги работы Росимущества Владимир Путин обсудил с главой ведомства Вадимом Яковенко; Куба переживает нефтяную блокаду США.
12 февраля, 18:30",,"Release of the program ""Time"" from 07.02. 2026","News release at 18:00 from 12.02. 2026
See in this issue: a group strike of our army on enemy military rears; the command post of one of the formations of the group of troops ""South"" was visited by Defense Minister Andrei Belousov; large-scale exercises at the site of the Caspian Flotilla in Dagestan; the results of the work of the Federal Property Management Agency Vladimir Putin discussed with the head of the department Vadim Yakovenko; Cuba is experiencing an oil blockade of the United States.
February 12, 18:30"
