url,title,date_extracted,content,category,title_en,content_en
https://www.1tv.ru/news/2026-01-15/531099,Сергей Собянин дал старт проходке нового тоннеля Рублево-Архангельской линии метрополитена,2026-01-15,"Это самый сложный участок, который пройдет в том числе под Москвой-рекой. Старт проходке тоннеля дал мэр Сергей Собянин. Полностью линия должна быть готова в следующем году.",,Sergey Sobyanin launched the new tunnel Rublevo-Arkhangelsk metro line,"This is the most difficult section, which will be held under the Moscow River. The start of the tunnel was given by Mayor Sergei Sobyanin. The full line should be ready next year."
https://www.1tv.ru/news/2026-01-15/531098,В Польше начато рассмотрение дела об экстрадиции археолога Александра Бутягина,2026-01-15,Сотрудника Эрмитажа задержали в начале декабря по запросу из Киева якобы за незаконные раскопки в Крыму. Бутягин все обвинения отвергает.,,In Poland began consideration of the case of extradition of archaeologist Alexander Butyagin,An employee of the Hermitage was detained in early December at the request of Kiev allegedly for illegal excavations in the Crimea. Butyagin denies all charges.
https://www.1tv.ru/news/2026-01-15/531097,Глава МИД Гренландии не смогла сдержать эмоций после переговоров с американцами,2026-01-15,"Не исключено — из-за того, сколько помощи пока направили союзники по НАТО на ее родину: 15 французских военных, 13 немцев и два норвежских офицера. Если Америка нападет, то силы явно не равны.",,Greenland's foreign minister could not contain emotions after talks with Americans,"It’s not out of the question because of how much aid NATO allies have sent to her homeland so far: 15 French soldiers, 13 Germans and two Norwegian officers. If America attacks, the forces are clearly not equal."
https://www.1tv.ru/news/2026-01-15/531096,"Глава европейской дипломатии Кая Каллас завила, что «сейчас самое время начать пить»",2026-01-15,"Каким видит мир глава европейской дипломатии Кая Каллас, что ей кажется, что сейчас самое время начать пить? Такой вопрос возникает после прочтения одного из материалов авторитетного издания Politico.",,The head of European diplomacy Kaja Kallas said that “now is the time to start drinking”.,"How does the head of European diplomacy, Kaja Kallas, see the world that she thinks now is the time to start drinking? This question arises after reading one of the materials of the authoritative publication Politico."
https://www.1tv.ru/news/2026-01-15/531095,"США пока не ударили по Ирану, несмотря сделанные накануне анонсы американских СМИ",2026-01-15,"Убедить Трампа «дать Ирану шанс» удалось Саудовской Аравии, Катару и Оману, пишет France Press. В свою очередь Тегеран открыл воздушное пространство над страной.",,"The United States has not yet struck Iran, despite the announcements made yesterday by the American media","To convince trump “to give Iran a chance” managed Saudi Arabia, Qatar and Oman, writes France Press. Tehran opened its airspace over the country."
https://www.1tv.ru/news/2026-01-15/531094,Владимир Путин поздравил сотрудников СК России с 15-летием со дня создания ведомства,2026-01-15,Самая молодая правоохранительная структура нашей страны с момента основания на переднем крае борьбы с преступностью и терроризмом. А с началом спецоперации передний край приобрел буквальный смысл.,,Vladimir Putin congratulated the employees of the Investigative Committee of Russia on the 15th anniversary of the establishment of the department,"It is the youngest law enforcement agency in our country since it was founded at the forefront of the fight against crime and terrorism. And with the beginning of the special operation, the front edge acquired a literal meaning."
https://www.1tv.ru/news/2026-01-15/531093,Поддержку промышленности и борьбу с мошенниками сегодня обсуждали в правительстве,2026-01-15,"Новые меры поддержки значимых предприятий металлургии, машиностроения и других ключевых отраслей в ДНР, ЛНР, Запорожской и Херсонской областях обсуждали на заседании правительства.",,Support of industry and fight against fraudsters discussed in the government,"New measures to support significant enterprises of metallurgy, mechanical engineering and other key industries in the DPR, LPR, Zaporozhye and Kherson regions were discussed at a government meeting."
https://www.1tv.ru/news/2026-01-15/531092,"ФСБ разоблачила шпиона, работавшего под прикрытием в посольстве Великобритании",2026-01-15,В МИД России вызвали временную поверенную в делах Великобритании. Там Дейни Долакия провела 15 минут. Ей заявили решительный протест.,,FSB exposes spy who worked undercover at British embassy,The Russian Foreign Ministry called the Chargé d'affaires of Great Britain. Daney Dolakia spent 15 minutes there. She was strongly protested.
https://www.1tv.ru/news/2026-01-15/531091,Исполнилось 100 лет со дня образования 234-го Гвардейского десантно-штурмового полка,2026-01-15,"Полк вписал много славных страниц в военную историю нашего государства: Великая Отечественная, Афганистан, Северный Кавказ, Югославия, Приднестровье.",,100 years since the formation of the 234th Guards Airborne Assault Regiment,"The regiment has written many glorious pages in the military history of our state: the Great Patriotic War, Afghanistan, the North Caucasus, Yugoslavia, Transnistria."
https://www.1tv.ru/news/2026-01-15/531090,О продвижении нашей армии говорил начальник Генштаба в ходе инспекции группировки «Центр»,2026-01-15,"Наша армия продолжает выполнять задачи, поставленные руководством страны. Валерий Герасимов привел такие данные: за две недели января врага выбили из восьми населенных пунктов.",,The Chief of the General Staff spoke about the advancement of our army during the inspection of the Center group,"Our army continues to fulfill the tasks set by the leadership of the country. Valery Gerasimov gave the following data: in two weeks of January, the enemy was knocked out of eight settlements."
https://www.1tv.ru/news/2026-01-16/531179,Выпуск программы «Время» от 16.01.2026,2026-01-16,Смотрите в этом выпуске: президент провел совещание по вопросам развития автономных систем; еще два населенных пункта под контролем российской армии; Вооруженные силы РФ продолжают уничтожение украинских формирований в Константиновке ДНР; «Единая Россия» и фонд «Ветераны СВО и КТО» передали нашим защитникам важный и нужный груз,,"Release of the program ""Time"" from 16.01. 2026",The President held a meeting on the development of autonomous systems; two more settlements under the control of the Russian army; The Russian Armed Forces continue to destroy Ukrainian units in the DPR Konstantinovka; United Russia and the Veterans of the SVO and Who Foundation handed over important and necessary cargo to our defenders.
https://www.1tv.ru/news/2026-01-16/531198,Событием новогоднего телевизионного эфира признана праздничная ночь на Первом канале,2026-01-16,"В новогоднюю ночь именно наш канал смотрели в общей сложности больше пятидесяти одного миллиона россиян. Спасибо, что в это особое время свое настроение вы доверили нам!",,The event of the New Year's TV broadcast recognized festive night on the First channel,"On New Year’s Eve, our channel was watched in total by more than fifty-one million Russians. Thank you for trusting us at this special time!"
https://www.1tv.ru/news/2026-01-16/531186,«ТОТ самый №13» — новая версия легендарного спектакля от звезд театра Олега Табакова,2026-01-16,"Эта комедия положений, едва выйдя 25 лет назад, просто взорвала театральный мир. Билеты разлетались мгновенно, на лишний билетик очередь начиналась аж от метро.",,"""TOT No13"" - a new version of the legendary performance from the stars of the theater Oleg Tabakov","This sitcom, barely coming out 25 years ago, just blew up the theatrical world. Tickets flew instantly, the queue for an extra ticket began even from the metro."
https://www.1tv.ru/news/2026-01-16/531187,В отдельных районах Подмосковья в выходные возможен мороз до минус 27 градусов,2026-01-16,"В столице на выходных тоже холодно — до минус 12 днем, значительно ниже нормы. И аномально высокое атмосферное давление — более 770 миллиметров ртутного столба.",,In some areas of the suburbs on the weekend possible frost to minus 27 degrees,"In the capital on the weekend is also cold - up to minus 12 in the afternoon, much lower than normal. And the abnormally high atmospheric pressure is more than 770 millimeters of mercury."
https://www.1tv.ru/news/2026-01-16/531197,Президент поручил подготовить план по внедрению беспилотных технологий в ключевых секторах экономики,2026-01-16,"Президент на базе московского метрополитена, в депо «Аминьевское» проводит совещание по развитию автономных систем. И вот что в начале заявил глава государства.",,The President instructed to prepare a plan for the introduction of unmanned technologies in key sectors of the economy,"The President, on the basis of the Moscow metro, at the Aminevskoye depot, holds a meeting on the development of autonomous systems. This is what the head of state said at the beginning."
https://www.1tv.ru/news/2026-01-16/531185,"В центре им. Бурденко раненому бойцу удалили осколок из головного мозга, полностью сохранив все функции",2026-01-16,"Нашему военнослужащему нужно вытащить осколок из головы, пациент должен быть в сознании, а хирурги и сами как будто идут по минному полю — нельзя ошибиться ни на миллиметр, чтобы сохранить все функции мозга. И им это удалось.",,"In the middle. Burdenko wounded fighter removed a fragment from the brain, fully preserving all functions","Our serviceman needs to get the shard out of his head, the patient needs to be conscious, and the surgeons themselves seem to be walking through a minefield - you can not make a millimeter mistake to preserve all the functions of the brain. And they did."
https://www.1tv.ru/news/2026-01-16/531193,В Армении суд отменил решение о домашнем аресте Самвела Карапетяна,2026-01-16,"Карапетяна задержали в июне, обвинив в призывах к государственному перевороту. Бизнесмен открыто критиковал власти республики и встал на защиту Армянской апостольской церкви.",,Armenian court overturns decision on house arrest of Samvel Karapetyan,"Karapetyan was detained in June, accused of calling for a coup. The businessman openly criticized the authorities of the republic and defended the Armenian Apostolic Church."
https://www.1tv.ru/news/2026-01-16/531196,Корина Мачадо передала свою Нобелевскую премию мира Дональду Трампу,2026-01-16,"Их встреча состоялась в Белом доме и длилась более двух часов. Трамп поблагодарил свою гостью, назвал ее «замечательной женщиной».",,Corina Machado gives her Nobel Peace Prize to Donald Trump,"The meeting took place at the White House and lasted more than two hours. Trump thanked his guest and called her a ""wonderful woman."""
https://www.1tv.ru/news/2026-01-16/531181,В Сети предлагают привлечь животных к защите Гренландии от американского вторжения,2026-01-16,"В Интернете популярность набирают вирусные видео и фото. Армия моржей, косаток и медведей противостоит вторжению и нападает на санках и лыжах на американскую армаду, и все это было бы смешно, но совсем не смешно почему-то.",,The Network proposes to attract animals to protect Greenland from American invasion,"On the Internet, viral videos and photos are gaining popularity. An army of walruses, killer whales and bears resist the invasion and attack the American armada on sleds and skis, and all this would be ridiculous, but not funny for some reason."
https://www.1tv.ru/news/2026-01-16/531189,Европа направит на защиту Гренландии чуть больше 30 военных,2026-01-16,"Если вдруг Америка войдет в воды острова на каком-то из своих авианосцев, то ей будет противостоять 15 французов, 13 немцев, по двое военных от Норвегии и Финляндии и по одному от Британии, Нидерландов, еще несколько человек от Швеции и Эстонии.",,Europe will send a little more than 30 troops to protect Greenland,"If America suddenly enters the waters of the island on one of its aircraft carriers, it will be confronted by 15 French, 13 Germans, two soldiers from Norway and Finland and one from Britain, the Netherlands, several people from Sweden and Estonia."
https://www.1tv.ru/news/2026-01-16/531188,"Россия осуждает любые формы внешнего вмешательства в Иран, заявил постпред РФ при ООН Василий Небензя",2026-01-16,"Балаган, недостойный Совета безопасности ООН. Так оценил заседание в Нью-Йорке наш постпред Василий Небензя.",,"Russia condemns any form of external intervention in Iran, said Russian Ambassador to the UN Vasily Nebenzia","Balagan, unworthy of the UN Security Council. This is how our Permanent Representative Vasily Nebenzia assessed the meeting in New York."
https://www.1tv.ru/news/2026-01-16/531184,О ситуации в Иране Владимир Путин говорил с Биньямином Нетаньяху и Масудом Пезешкианом,2026-01-16,Владимир Путин сегодня провел сразу два международных телефонных разговора — с премьер-министром Израиля и президентом Ирана.,,"On the situation in Iran, Vladimir Putin spoke with Benjamin Netanyahu and Masoud Peseshkin",Vladimir Putin held two international telephone conversations with the Prime Minister of Israel and the President of Iran.
https://www.1tv.ru/news/2026-01-16/531169,Владимир Путин проводит совещание по вопросам развития автономных систем,2026-01-16,"Беспилотные поезда на железной дороге и в метро, беспилотные трамваи, беспилотные такси, роботы-уборщики, грузовики, сельскохозяйственные дроны и автоматизированные тракторы.",,Vladimir Putin holds a meeting on the development of autonomous systems,"Unmanned trains on the railway and subway, unmanned trams, unmanned taxis, robot cleaners, trucks, agricultural drones and automated tractors."
https://www.1tv.ru/news/2026-01-16/531183,Высший антикоррупционный суд Украины определил залог для Юлии Тимошенко в 770 тысяч долларов,2026-01-16,"Тимошенко не может покидать Киевскую область, обязана сдать загранпаспорт и являться по первому звонку из Национального антикоррупционного бюро.",,The Supreme anti-corruption court of Ukraine has determined the bail for Yulia Tymoshenko at 770 thousand dollars,"Tymoshenko cannot leave the Kiev region, must pass her passport and appear on the first call from the National Anti-Corruption Bureau."
https://www.1tv.ru/news/2026-01-16/531182,"В Москве и Чувашии задержаны подростки, которые действовали по заданию украинских спецслужб",2026-01-16,"О том, как безобидное, на первый взгляд, знакомство в интернете может сломать жизнь. Четверо подростков задержаны в Москве и Чувашии за терроризм и порчу имущества.",,In Moscow and Chuvashia detained teenagers who acted on the instructions of the Ukrainian special services,"About how harmless, at first glance, acquaintance on the Internet can break a life. Four teenagers were detained in Moscow and Chuvashia for terrorism and property damage."
https://www.1tv.ru/news/2026-01-17/531248,Выпуск программы «Время» от 17.01.2026,2026-01-17,"Смотрите в этом выпуске: в зоне спецоперации противника выбили еще из двух населенных пунктов, а под Харьковом уничтожен Patriot; репортаж — бойцы рассказали подробности освобождения Закотного в ДНР; массовые акции против планов Трампа проходят в Гренландии и разных городах Дании; в Москве простились с талантливым актером, ректором школы-студии МХАТ Игорем Золотовицким;",,"Release of the program ""Time"" from 17.01. 2026","See in this issue: in the zone of the special operation, the enemy was knocked out of two more settlements, and near Kharkov, Patriot was destroyed; the report - the soldiers told the details of Zakotny's release in the DPR; mass actions against Trump's plans are held in Greenland and different cities of Denmark; in Moscow, they said goodbye to the talented actor, rector of the Moscow Art Art Theater school-studio Igor Zolotovitsky;"
https://www.1tv.ru/news/2026-01-17/531264,Трамп введет пошлины в размере 10% на ряд европейских стран из-за Гренландии,2026-01-17,"Отмечается, что с 1 июня 2026 года размер ставки увеличится до 25%.",,Trump will impose duties of 10% on several European countries because of Greenland,"It is noted that from June 1, 2026, the rate will increase to 25%."
https://www.1tv.ru/news/2026-01-17/531263,Новый выпуск этнопроекта «Хочется праздника!» будет посвящен Крещению,2026-01-17,"Команда молодых этнографов окажется в 1899 году в той же деревне, где они не так давно пережили Рождественское чудо — только теперь в канун Крещения Господня.",,The new issue of the ethno project “I want a holiday!” will be dedicated to the Baptism,A team of young ethnographers will be in 1899 in the same village where they recently experienced the Christmas miracle - only now on the eve of the Baptism of the Lord.
https://www.1tv.ru/news/2026-01-17/531261,Одним из интересных атрибутов веселья и гуляний становится русский кокошник,2026-01-17,"Настоящий модный бум на старинный головной убор, который добавляет в образы женственность, неповторимый стиль и первозданную красоту. Русские промыслы Гжель, Жостово, Хохлома, Палех, Федоскино, Мстера.",,One of the interesting attributes of fun and festivities is the Russian Kokoshnik.,"A real fashion boom on an old headdress, which adds femininity, unique style and pristine beauty to the images. Russian crafts Gzhel, Zhostovo, Khokhloma, Paleh, Fedoskino, Mstera."
https://www.1tv.ru/news/2026-01-17/531260,Празднования и гуляния в честь Святок состоялись на самом большом катке Москвы,2026-01-17,"В Москве, на ВДНХ, проводили Святки. Уже завтра канун Богоявления, Крещенский Сочельник, а сегодня время традиционных народных забав и активного отдыха.",,Celebrations and festivities in honor of Svyatok took place at the largest rink in Moscow,"In Moscow, at VDNKh, they held Svyatka. Tomorrow is the Eve of the Epiphany, Epiphany Eve, and today is the time for traditional folk fun and active recreation."
https://www.1tv.ru/news/2026-01-17/531258,В День артиста деятелям культуры вручили госнаграды и присвоили почетные звания,2026-01-17,В России сегодня впервые отмечают новый профессиональный праздник — День артиста. Дата выбрана неслучайно. 17 января родился первый Народный артист СССР Константин Станиславский.,,"On the Day of the Artist, cultural figures were awarded state awards and awarded honorary titles",In Russia today for the first time celebrates a new professional holiday – Artist’s Day. The date was not chosen by chance. January 17 was born the first People's Artist of the USSR Konstantin Stanislavsky.
